{
  "schema_version": "1.0",
  "task_id": "EPIC-001",
  "title": "Read-only Epic Sandbox clinical context",
  "type": "feature",
  "status": "PROPOSED",
  "priority": "critical",
  "owners": {
    "orchestrator": "codex",
    "architecture": "codex",
    "database": "codex",
    "backend": "codex",
    "frontend": "codex",
    "tester": "codex",
    "security": "codex",
    "review": "codex"
  },
  "spec": "docs/features/EPIC-001.md",
  "contracts": [],
  "scope": {
    "database": [
      "backend/alembic/**"
    ],
    "backend": [
      "backend/**"
    ],
    "frontend": [
      "frontend/**"
    ],
    "other": [
      ".ai/project.json",
      "README.md",
      "docs/operations/**",
      "docs/operator/**"
    ]
  },
  "permissions": {
    "orchestrator": {
      "allowed_write_paths": [
        ".ai/tasks/EPIC-001/task.json",
        "docs/features/EPIC-001.md",
        "docs/architecture/**",
        "docs/adr/**",
        "contracts/**",
        ".ai/tasks/EPIC-001/frontend-design-review.json",
        ".ai/project.json",
        "README.md",
        "docs/operations/**",
        "docs/operator/**"
      ],
      "read_only_paths": [
        "backend/**",
        "frontend/**",
        "database/**",
        "supabase/**",
        "tests/**",
        "docs/standards/**",
        ".ai/tasks/EPIC-001/frontend-design-report.json"
      ],
      "forbidden_paths": []
    },
    "architecture": {
      "allowed_write_paths": [
        "docs/features/EPIC-001.md",
        "docs/architecture/**",
        "docs/adr/**",
        ".ai/tasks/EPIC-001/architecture-report.json"
      ],
      "read_only_paths": [
        "contracts/**",
        "backend/**",
        "frontend/**",
        "database/**",
        "supabase/**",
        "docs/standards/**",
        ".ai/tasks/EPIC-001/task.json"
      ],
      "forbidden_paths": [
        ".ai/tasks/EPIC-001/task.json"
      ]
    },
    "database": {
      "allowed_write_paths": [
        "backend/alembic/**",
        ".ai/tasks/EPIC-001/database-report.json"
      ],
      "read_only_paths": [
        "contracts/**",
        "docs/**",
        "backend/**",
        ".ai/tasks/EPIC-001/task.json",
        ".ai/tasks/EPIC-001/architecture-report.json"
      ],
      "forbidden_paths": [
        "frontend/**",
        ".ai/tasks/EPIC-001/task.json"
      ]
    },
    "backend": {
      "allowed_write_paths": [
        "backend/**",
        "tests/backend/**",
        ".ai/tasks/EPIC-001/backend-report.json"
      ],
      "read_only_paths": [
        "contracts/**",
        "docs/**",
        "database/**",
        "supabase/**",
        ".ai/tasks/EPIC-001/task.json",
        ".ai/tasks/EPIC-001/architecture-report.json",
        ".ai/tasks/EPIC-001/database-report.json"
      ],
      "forbidden_paths": [
        "frontend/**",
        ".ai/tasks/EPIC-001/task.json",
        "backend/alembic/**"
      ]
    },
    "frontend": {
      "allowed_write_paths": [
        "frontend/**",
        "tests/frontend/**",
        "docs/design/**",
        ".ai/tasks/EPIC-001/frontend-design-report.json",
        ".ai/tasks/EPIC-001/frontend-report.json"
      ],
      "read_only_paths": [
        "docs/features/**",
        "docs/architecture/**",
        "docs/adr/**",
        "docs/standards/**",
        "docs/operations/**",
        "docs/operator/**",
        "contracts/**",
        ".ai/tasks/EPIC-001/task.json",
        ".ai/tasks/EPIC-001/architecture-report.json",
        ".ai/tasks/EPIC-001/database-report.json",
        ".ai/tasks/EPIC-001/backend-report.json",
        ".ai/tasks/EPIC-001/frontend-design-review.json"
      ],
      "forbidden_paths": [
        "backend/**",
        "database/**",
        "supabase/**",
        "contracts/**",
        ".ai/tasks/EPIC-001/task.json"
      ]
    },
    "tester": {
      "allowed_write_paths": [
        "tests/**",
        ".ai/tasks/EPIC-001/test-report.json",
        "frontend/tests/**"
      ],
      "read_only_paths": [
        "backend/**",
        "database/**",
        "supabase/**",
        "contracts/**",
        "docs/**",
        ".ai/tasks/EPIC-001/**",
        "frontend/src/**",
        "frontend/public/**",
        "frontend/package.json",
        "frontend/playwright.config.ts"
      ],
      "forbidden_paths": [
        "backend/**",
        "database/**",
        "supabase/**",
        "contracts/**",
        ".ai/tasks/EPIC-001/task.json"
      ]
    },
    "security": {
      "allowed_write_paths": [
        ".ai/tasks/EPIC-001/security-report.json"
      ],
      "read_only_paths": [
        "backend/**",
        "frontend/**",
        "database/**",
        "supabase/**",
        "contracts/**",
        "docs/**",
        "tests/**",
        ".ai/tasks/EPIC-001/**"
      ],
      "forbidden_paths": [
        "backend/**",
        "frontend/**",
        "database/**",
        "supabase/**",
        "contracts/**",
        "tests/**",
        ".ai/tasks/EPIC-001/task.json"
      ]
    },
    "review": {
      "allowed_write_paths": [
        ".ai/tasks/EPIC-001/review-report.json"
      ],
      "read_only_paths": [
        "backend/**",
        "frontend/**",
        "database/**",
        "supabase/**",
        "contracts/**",
        "docs/**",
        "tests/**",
        ".ai/tasks/EPIC-001/**"
      ],
      "forbidden_paths": [
        "backend/**",
        "frontend/**",
        "database/**",
        "supabase/**",
        "contracts/**",
        "tests/**",
        ".ai/tasks/EPIC-001/task.json"
      ]
    }
  },
  "state_write_policy": {
    "task_file": ".ai/tasks/EPIC-001/task.json",
    "single_writer": "orchestrator",
    "worker_agents_must_use_reports": true
  },
  "dependencies": [
    "ACCESS-001"
  ],
  "acceptance_criteria": [
    "A private preflight authorizes or refreshes Epic Sandbox access without exposing credentials, codes, or tokens in source control, chat, browser output, normal logs, reports, or ordinary UI.",
    "The recorded journey reaches an already-connected Camila staff record without displaying Epic authentication.",
    "OAuth state, nonce, issuer, redirect, transaction, scope, expiry, refresh rotation, encryption, revocation, and redaction controls pass targeted tests and security review.",
    "Camila's staff record shows only facts returned by enabled R4 Read/Search APIs or the versioned last-known-good snapshot, with per-item provenance.",
    "A successful refresh publishes a complete snapshot atomically; partial or failed refreshes never combine old and new fields under a Live label.",
    "Live failure serves the prior complete snapshot only as Snapshot fallback with its original synchronization time; no snapshot produces Unavailable.",
    "Public, patient, caregiver, and transportation responses, search, exports, logs, and accessible text exclude Epic-only clinical fields. Approved staff UI/accessibility and authorized staff evidence exports retain required context; normal logs remain redacted.",
    "Only Camila is Epic-backed, non-Camila fixtures trigger no Epic request, and all Epic operations remain read-only.",
    "The UI provides accessible loading, empty, partial-source, unauthorized, expiry, rate/error, fallback, and unavailable states without unsupported partnership, production, or writeback claims."
  ],
  "created_by": "human"
}
