{
  "schema_version": "1.0",
  "task_id": "OUTREACH-001",
  "title": "One real SMS and one short live call",
  "type": "feature",
  "status": "PROPOSED",
  "priority": "high",
  "owners": {
    "orchestrator": "codex",
    "architecture": "codex",
    "database": "codex",
    "backend": "codex",
    "frontend": "codex",
    "tester": "codex",
    "security": "codex",
    "review": "codex"
  },
  "spec": "docs/features/OUTREACH-001.md",
  "contracts": [],
  "scope": {
    "database": [
      "backend/alembic/**"
    ],
    "backend": [
      "backend/**"
    ],
    "frontend": [
      "frontend/**"
    ],
    "other": [
      ".ai/project.json",
      "README.md",
      "docs/operations/**",
      "docs/operator/**"
    ]
  },
  "permissions": {
    "orchestrator": {
      "allowed_write_paths": [
        ".ai/tasks/OUTREACH-001/task.json",
        "docs/features/OUTREACH-001.md",
        "docs/architecture/**",
        "docs/adr/**",
        "contracts/**",
        ".ai/tasks/OUTREACH-001/frontend-design-review.json",
        ".ai/project.json",
        "README.md",
        "docs/operations/**",
        "docs/operator/**"
      ],
      "read_only_paths": [
        "backend/**",
        "frontend/**",
        "database/**",
        "supabase/**",
        "tests/**",
        "docs/standards/**",
        ".ai/tasks/OUTREACH-001/frontend-design-report.json"
      ],
      "forbidden_paths": []
    },
    "architecture": {
      "allowed_write_paths": [
        "docs/features/OUTREACH-001.md",
        "docs/architecture/**",
        "docs/adr/**",
        ".ai/tasks/OUTREACH-001/architecture-report.json"
      ],
      "read_only_paths": [
        "contracts/**",
        "backend/**",
        "frontend/**",
        "database/**",
        "supabase/**",
        "docs/standards/**",
        ".ai/tasks/OUTREACH-001/task.json"
      ],
      "forbidden_paths": [
        ".ai/tasks/OUTREACH-001/task.json"
      ]
    },
    "database": {
      "allowed_write_paths": [
        "backend/alembic/**",
        ".ai/tasks/OUTREACH-001/database-report.json"
      ],
      "read_only_paths": [
        "contracts/**",
        "docs/**",
        "backend/**",
        ".ai/tasks/OUTREACH-001/task.json",
        ".ai/tasks/OUTREACH-001/architecture-report.json"
      ],
      "forbidden_paths": [
        "frontend/**",
        ".ai/tasks/OUTREACH-001/task.json"
      ]
    },
    "backend": {
      "allowed_write_paths": [
        "backend/**",
        "tests/backend/**",
        ".ai/tasks/OUTREACH-001/backend-report.json"
      ],
      "read_only_paths": [
        "contracts/**",
        "docs/**",
        "database/**",
        "supabase/**",
        ".ai/tasks/OUTREACH-001/task.json",
        ".ai/tasks/OUTREACH-001/architecture-report.json",
        ".ai/tasks/OUTREACH-001/database-report.json"
      ],
      "forbidden_paths": [
        "frontend/**",
        ".ai/tasks/OUTREACH-001/task.json",
        "backend/alembic/**"
      ]
    },
    "frontend": {
      "allowed_write_paths": [
        "frontend/**",
        "tests/frontend/**",
        "docs/design/**",
        ".ai/tasks/OUTREACH-001/frontend-design-report.json",
        ".ai/tasks/OUTREACH-001/frontend-report.json"
      ],
      "read_only_paths": [
        "docs/features/**",
        "docs/architecture/**",
        "docs/adr/**",
        "docs/standards/**",
        "docs/operations/**",
        "docs/operator/**",
        "contracts/**",
        ".ai/tasks/OUTREACH-001/task.json",
        ".ai/tasks/OUTREACH-001/architecture-report.json",
        ".ai/tasks/OUTREACH-001/database-report.json",
        ".ai/tasks/OUTREACH-001/backend-report.json",
        ".ai/tasks/OUTREACH-001/frontend-design-review.json"
      ],
      "forbidden_paths": [
        "backend/**",
        "database/**",
        "supabase/**",
        "contracts/**",
        ".ai/tasks/OUTREACH-001/task.json"
      ]
    },
    "tester": {
      "allowed_write_paths": [
        "tests/**",
        ".ai/tasks/OUTREACH-001/test-report.json",
        "frontend/tests/**"
      ],
      "read_only_paths": [
        "backend/**",
        "database/**",
        "supabase/**",
        "contracts/**",
        "docs/**",
        ".ai/tasks/OUTREACH-001/**",
        "frontend/src/**",
        "frontend/public/**",
        "frontend/package.json",
        "frontend/playwright.config.ts"
      ],
      "forbidden_paths": [
        "backend/**",
        "database/**",
        "supabase/**",
        "contracts/**",
        ".ai/tasks/OUTREACH-001/task.json"
      ]
    },
    "security": {
      "allowed_write_paths": [
        ".ai/tasks/OUTREACH-001/security-report.json"
      ],
      "read_only_paths": [
        "backend/**",
        "frontend/**",
        "database/**",
        "supabase/**",
        "contracts/**",
        "docs/**",
        "tests/**",
        ".ai/tasks/OUTREACH-001/**"
      ],
      "forbidden_paths": [
        "backend/**",
        "frontend/**",
        "database/**",
        "supabase/**",
        "contracts/**",
        "tests/**",
        ".ai/tasks/OUTREACH-001/task.json"
      ]
    },
    "review": {
      "allowed_write_paths": [
        ".ai/tasks/OUTREACH-001/review-report.json"
      ],
      "read_only_paths": [
        "backend/**",
        "frontend/**",
        "database/**",
        "supabase/**",
        "contracts/**",
        "docs/**",
        "tests/**",
        ".ai/tasks/OUTREACH-001/**"
      ],
      "forbidden_paths": [
        "backend/**",
        "frontend/**",
        "database/**",
        "supabase/**",
        "contracts/**",
        "tests/**",
        ".ai/tasks/OUTREACH-001/task.json"
      ]
    }
  },
  "state_write_policy": {
    "task_file": ".ai/tasks/OUTREACH-001/task.json",
    "single_writer": "orchestrator",
    "worker_agents_must_use_reports": true
  },
  "dependencies": [
    "RAIL-001",
    "FLOW-001"
  ],
  "acceptance_criteria": [
    "One explicit protected SMS action sends the reviewed nonclinical text to the single configured consenting test recipient and the message is actually received; retain sanitized provider/recipient evidence. Provider acceptance alone is not delivery.",
    "One explicit protected call action rings the configured phone and plays the prepared reviewed audio audibly, then ends within the configured 60-second cap. A short recorded voice message is sufficient; retain sanitized live evidence.",
    "The browser cannot choose an arbitrary number or script, obtain secrets, or bypass operator protection, consent, arming, expiry and configured attempt/cost limits; verify negative API tests and dedicated security review.",
    "Double-clicks, request retries, process restart, repeated callbacks and scenario reset cannot dispatch an uncontrolled duplicate. Reserve each live attempt before sending; ambiguous provider submission becomes outcome unknown and blocks another call until resolved.",
    "Real status distinguishes submitted, delivered, ringing, answered/completed, failed/unknown and any explicit response. Success originates only from verified provider evidence; do not treat call completion as recipient acknowledgment.",
    "One SMS arm permits one SMS. Each call arm permits one call in a finite wall-clock window. After a confirmed final call outcome, the operator may open another call window, subject to fixed recipient, consent, daily attempt cap and operator protection. Active or unknown calls block a new call across devices. Ordinary replay/checkpoint/reset never arms or sends; verify network-denial and persistence checks.",
    "Missing provider setup, invalid callbacks, opt-out or kill switch produce a visible unavailable/stopped state without a fake success. The live ledger, limits and consent survive reset.",
    "A recorded backup call and SMS evidence can be played after explicit disclosure if live delivery fails. Keep live failure status intact; playback cannot satisfy the real-delivery acceptance.",
    "The chosen communication control and timeline states preserve the locked UI. Full phone-to-workflow synchronization is not required: the presenter may advance the prepared patient story separately.",
    "Opening an outreach-history row shows scheduled time, sent text/time, received reply/time and the follow-up change from the shared scenario fixture. Historical prepared events are distinguishable in source details from the genuine one-off SMS/call and make no provider requests; verify thread/timeline parity."
  ],
  "created_by": "human"
}
