{
  "schema_version": "1.0",
  "task_id": "RIDE-001",
  "title": "CareLink contracted-provider dispatch",
  "type": "feature",
  "status": "PROPOSED",
  "priority": "critical",
  "owners": {
    "orchestrator": "codex",
    "architecture": "codex",
    "database": "codex",
    "backend": "codex",
    "frontend": "codex",
    "tester": "codex",
    "security": "codex",
    "review": "codex"
  },
  "spec": "docs/features/RIDE-001.md",
  "contracts": [],
  "scope": {
    "database": [
      "backend/alembic/**"
    ],
    "backend": [
      "backend/**"
    ],
    "frontend": [
      "frontend/**"
    ],
    "other": []
  },
  "permissions": {
    "orchestrator": {
      "allowed_write_paths": [
        ".ai/tasks/RIDE-001/task.json",
        "docs/features/RIDE-001.md",
        "docs/architecture/**",
        "docs/adr/**",
        "contracts/**",
        ".ai/tasks/RIDE-001/frontend-design-review.json"
      ],
      "read_only_paths": [
        "backend/**",
        "frontend/**",
        "database/**",
        "supabase/**",
        "tests/**",
        "docs/standards/**",
        ".ai/tasks/RIDE-001/frontend-design-report.json"
      ],
      "forbidden_paths": []
    },
    "architecture": {
      "allowed_write_paths": [
        "docs/features/RIDE-001.md",
        "docs/architecture/**",
        "docs/adr/**",
        ".ai/tasks/RIDE-001/architecture-report.json"
      ],
      "read_only_paths": [
        "contracts/**",
        "backend/**",
        "frontend/**",
        "database/**",
        "supabase/**",
        "docs/standards/**",
        ".ai/tasks/RIDE-001/task.json"
      ],
      "forbidden_paths": [
        ".ai/tasks/RIDE-001/task.json"
      ]
    },
    "database": {
      "allowed_write_paths": [
        "backend/alembic/**",
        ".ai/tasks/RIDE-001/database-report.json"
      ],
      "read_only_paths": [
        "contracts/**",
        "docs/**",
        "backend/**",
        ".ai/tasks/RIDE-001/task.json",
        ".ai/tasks/RIDE-001/architecture-report.json"
      ],
      "forbidden_paths": [
        "frontend/**",
        ".ai/tasks/RIDE-001/task.json"
      ]
    },
    "backend": {
      "allowed_write_paths": [
        "backend/**",
        "tests/backend/**",
        ".ai/tasks/RIDE-001/backend-report.json"
      ],
      "read_only_paths": [
        "contracts/**",
        "docs/**",
        "database/**",
        "supabase/**",
        ".ai/tasks/RIDE-001/task.json",
        ".ai/tasks/RIDE-001/architecture-report.json",
        ".ai/tasks/RIDE-001/database-report.json"
      ],
      "forbidden_paths": [
        "frontend/**",
        ".ai/tasks/RIDE-001/task.json"
      ]
    },
    "frontend": {
      "allowed_write_paths": [
        "frontend/**",
        "tests/frontend/**",
        "docs/design/**",
        ".ai/tasks/RIDE-001/frontend-design-report.json",
        ".ai/tasks/RIDE-001/frontend-report.json"
      ],
      "read_only_paths": [
        "docs/features/**",
        "docs/architecture/**",
        "docs/adr/**",
        "docs/standards/**",
        "docs/operations/**",
        "docs/operator/**",
        "contracts/**",
        ".ai/tasks/RIDE-001/task.json",
        ".ai/tasks/RIDE-001/architecture-report.json",
        ".ai/tasks/RIDE-001/database-report.json",
        ".ai/tasks/RIDE-001/backend-report.json",
        ".ai/tasks/RIDE-001/frontend-design-review.json"
      ],
      "forbidden_paths": [
        "backend/**",
        "database/**",
        "supabase/**",
        "contracts/**",
        ".ai/tasks/RIDE-001/task.json"
      ]
    },
    "tester": {
      "allowed_write_paths": [
        "tests/**",
        ".ai/tasks/RIDE-001/test-report.json"
      ],
      "read_only_paths": [
        "backend/**",
        "frontend/**",
        "database/**",
        "supabase/**",
        "contracts/**",
        "docs/**",
        ".ai/tasks/RIDE-001/**"
      ],
      "forbidden_paths": [
        "backend/**",
        "frontend/**",
        "database/**",
        "supabase/**",
        "contracts/**",
        ".ai/tasks/RIDE-001/task.json"
      ]
    },
    "security": {
      "allowed_write_paths": [
        ".ai/tasks/RIDE-001/security-report.json"
      ],
      "read_only_paths": [
        "backend/**",
        "frontend/**",
        "database/**",
        "supabase/**",
        "contracts/**",
        "docs/**",
        "tests/**",
        ".ai/tasks/RIDE-001/**"
      ],
      "forbidden_paths": [
        "backend/**",
        "frontend/**",
        "database/**",
        "supabase/**",
        "contracts/**",
        "tests/**",
        ".ai/tasks/RIDE-001/task.json"
      ]
    },
    "review": {
      "allowed_write_paths": [
        ".ai/tasks/RIDE-001/review-report.json"
      ],
      "read_only_paths": [
        "backend/**",
        "frontend/**",
        "database/**",
        "supabase/**",
        "contracts/**",
        "docs/**",
        "tests/**",
        ".ai/tasks/RIDE-001/**"
      ],
      "forbidden_paths": [
        "backend/**",
        "frontend/**",
        "database/**",
        "supabase/**",
        "contracts/**",
        "tests/**",
        ".ai/tasks/RIDE-001/task.json"
      ]
    }
  },
  "state_write_policy": {
    "task_file": ".ai/tasks/RIDE-001/task.json",
    "single_writer": "orchestrator",
    "worker_agents_must_use_reports": true
  },
  "dependencies": [
    "FLOW-001"
  ],
  "acceptance_criteria": [
    "Deterministic checks cover cutoff, funding and eligibility, operating and arrival windows, outbound and return plans, mobility or escort needs, service area, and provider availability.",
    "Only authorized staff or transportation sessions can initiate or mutate a request, and request creation is idempotent through the server-side adapter.",
    "Requested, offered, accepted, driver assigned, patient notified, patient acknowledged, arriving, completed, cancelled, declined, provider unavailable, return pending, and backup required remain distinct events.",
    "Cancellation or failure reopens the blocker and permits controlled retry, backup, or escalation without losing the original audit history.",
    "No available option leaves treatment at risk, and patient acknowledgment is required before transportation work closes.",
    "The product never autonomously cancels or reschedules treatment and supports a center's contracted provider rather than requiring an OncoReady-owned fleet.",
    "Uber Health remains provider-ready and cannot claim a quote, request, driver, ETA, or completion without approved credentials and verified callbacks.",
    "Caregiver and transportation visual, accessibility, search, export, API, and log projections exclude clinical concern text and Epic-only fields."
  ],
  "created_by": "human"
}
